HitId,Text,Decision1,Decision2,Decision1_HitId,Decision2_HitId,Referring_Story_Id,Referring_Decision
ORIGINAL,"The monarchy raids the rebel insurgent headquarters, capturing the leader. He declares war against all who oppose him with the threat of public execution. You believe in the rebels\' cause to liberate the people, but you are also afraid of being killed by the monarchy. You hear a banging at your door by someone who ends up being a high ranking officer in the monarchy. He immediately finds out that you are building weapons for the insurgents.","Impale the officer, killing him.","You turn yourself in, begging on your knees declaring your loyalty to the monarchy.",3YLPJ8OXX8D170CI4QM4HD1Z4W2X43,389A2A304OIW5EJMUT3FRXQCM2ZC01,N/A,N/A
3YLPJ8OXX8D170CI4QM4HD1Z4W2X43,You look around and see some soldiers of the monarchy walking towards you. You have noticed that on that first moment they were focused on seeking and capturing other rebels and none of them have realized the dead officer\'s body in front of you.,Pull the body in and close the door,Leave the body and run away for cover.,3J5XXLQDHMBOLFOJ4XG3JNC8AMOV35,3ZG552ORAM4Z0XS00X2Y0D7G48OV2U,ORIGINAL,1
389A2A304OIW5EJMUT3FRXQCM2ZC01,"The officer pulls out his sword and threatens to kill you if you don\'t listen to his commands. He asks you to prove your loyalty to the monarchy, by giving away the identities of the insurgents. Your senses are heightened by your fear and adrenaline and you notice a smelting rod on the ground.",Tell the officer their identities.,Grab the rod to fight back.,3WRBLBQ2GR89MQZRWFZYHOBRKVH0GR,388CL5C1RJN0JIJO5E3Z08FG2T5HLG,ORIGINAL,2
3J5XXLQDHMBOLFOJ4XG3JNC8AMOV35,"THEN YOU MAKE CAVE INSIDE YOUR HOME TO HIDE OFFICER BODY.IT MAKES SOME NOICE. NOW DOOR KNOKING SOUND IS COME.YOU GO AND SEE WITHOUT OPEN DOOR BY WINDOW,ONE OFFICER IS THERE.",You RUN BY BACK DOOR,You HIDE BODY AND OPEN DOOR,,,3YLPJ8OXX8D170CI4QM4HD1Z4W2X43,1
3ZG552ORAM4Z0XS00X2Y0D7G48OV2U,"You find yourself in a forest, surrounded by dense and rather sinister looking trees. There is a path to your left and a path to your right.",You take the left path,You take the right path,,,3YLPJ8OXX8D170CI4QM4HD1Z4W2X43,2
3WRBLBQ2GR89MQZRWFZYHOBRKVH0GR,"AND YOU SLOWLY MOVE TOWARDS THE ROD.YOU TAKE THAT ROD AND HIT THAT OFFICER HE FELL DOWN.THEN YOU RUN AWAY FROM YOUR HOME AND DISAPPEARANCE INTO FOREST.NOW YOU REALIZE, ALL THE IDENTITIES YOU LEAVE FROM HOME", You gO TO HOME AND FIGHT WITH OFFICER TO REMOVE IDENTITIES,You gO FURTHER INTO FOREST AND MAKE YOUR LIFE IN FOREST,,,389A2A304OIW5EJMUT3FRXQCM2ZC01,1
388CL5C1RJN0JIJO5E3Z08FG2T5HLG,You turn around after grabbing the smelting rod. You\'re instincts kick in and you realize there are only two choices you could possibly make in this scenario.,"You fight the officers, and risk execution","You admit defeat, and stand down.",,,389A2A304OIW5EJMUT3FRXQCM2ZC01,2